{
  "self": "https://your-domain.atlassian.net/rest/api/issue/MKY-1/votes",
  "votes": 24,
  "hasVoted": true,
  "voters": [
    {
      "self": "https://your-domain.atlassian.net/rest/api/2/user?accountId=5b10a2844c20165700ede21g",
      "key": "",
      "accountId": "5b10a2844c20165700ede21g",
      "accountType": "atlassian",
      "name": "",
      "avatarUrls": {
        "48x48": "https://avatar-management--avatars.server-location.prod.public.atl-paas.net/initials/MK-5.png?size=48&s=48",
        "24x24": "https://avatar-management--avatars.server-location.prod.public.atl-paas.net/initials/MK-5.png?size=24&s=24",
        "16x16": "https://avatar-management--avatars.server-location.prod.public.atl-paas.net/initials/MK-5.png?size=16&s=16",
        "32x32": "https://avatar-management--avatars.server-location.prod.public.atl-paas.net/initials/MK-5.png?size=32&s=32"
      },
      "displayName": "Mia Krystof",
      "active": false
    }
  ]
}
